{
  "version": 1,
  "batch_ref": "examples/live-batch-experiment.json",
  "rates_ref": "examples/live-pilot-rates.json",
  "environment_ref": "examples/codex-environment.json",
  "model": "gpt-5.6-luna",
  "sandbox": "workspace-write",
  "timeout_seconds": 600,
  "task_bindings": [
    {
      "id": "median-fix",
      "evidence_contract_ref": "evidence-contract.json"
    }
  ]
}
